#,name,address,city,phone,email,website,category
301,Đức Vinh - Công Ty Cổ Phần Phát Triển Đức Vinh,"49 Hòa Bình, Q. Đống Đa, ",Hà Nội,(024) 38511612                                , ,,Khoáng Sản - Công Ty Khoáng Sản
302,Kỷ Tâm Nông Sơn - Công Ty Cổ Phần Kỷ Tâm Nông Sơn,"H. Nông Sơn,Thôn 3, X. Quế Trung, ",Quảng Nam,(0235) 3505034                                 , ,,Khoáng Sản - Công Ty Khoáng Sản
303,Tấn Phát - Công Ty TNHH Tấn Phát,"196 P. Ngô Mây,Diên Hồng, Tp. Quy Nhơn, ",Bình Định,(0256) 3522633                                 , ,,Khoáng Sản - Công Ty Khoáng Sản
304,Phương Đông - Công Ty TNHH Một Thành Viên Phương Đông,"Thôn Tích Phú, X. Đại Hiệp,H. Đại Lộc, ",Quảng Nam,(0235) 3762110                                 , ,,Khoáng Sản - Công Ty Khoáng Sản
305,Công Ty Cổ Phần Địa Chất Và Khoáng Sản Hà Nội,"40 Ngõ 155,Nguyễn Khang, Q. Cầu Giấy, ",Hà Nội,(024) 37840209                                , ,,Khoáng Sản - Công Ty Khoáng Sản
306,Phúc Thịnh - Công Ty TNHH Khai Thác & Chế Biến Khoáng Sản Phúc Thịnh,"X. Tân Lập,ấp 1, H. Tân Uyên, ",Bình Dương,(0274) 3682069                                 , ,,Khoáng Sản - Công Ty Khoáng Sản
307,TKV - Công Ty Cổ Phần Địa ốc Khoáng Sản TKV,"562 Nguyễn Văn Cừ, Q. Long Biên, ",Hà Nội,(024) 38770010                                ,vimico@hn.vnn.vn                                  ,,Khoáng Sản - Công Ty Khoáng Sản
308,Teparak - Công Ty TNHH Quốc Tế Teparak,"4/12 Dốc Bác Cổ, Q. Hoàn Kiếm, ",Hà Nội,(024) 38251156                                , ,,Khoáng Sản - Công Ty Khoáng Sản
309,Công Ty TNHH Xây Dựng Thương Mại Cầu Đường Chơn Thanh,"180 Nguyễn Du, Khu Phố Phú Hưng, P. Phú Thịnh, TX. Bình Long, ",Bình Phước,(0271) 666657                                  ,lethanhcan65@yahoo.com.vn                         ,,Khoáng Sản - Công Ty Khoáng Sản
310,Xí Nghiệp Quảng Ninh Hoá Chất Mỏ,"Tp. Hạ Long, ",Quảng Ninh,(0203) 3825349                                 , ,,Khoáng Sản - Công Ty Khoáng Sản
311,Công Ty Cổ Phần Xây Dựng & Đầu Tư Phát Triển Hạ Tầng Đô Thị Hà Nội,"28B/93 Hoàng Văn Thái, P. Khương Trung, Q. Thanh Xuân, ",Hà Nội,(024) 35658245                                , ,,Khoáng Sản - Công Ty Khoáng Sản
312,Tân Quang Cường - Công Ty TNHH Thương Mại,"343/5S Tô Hiến Thành, P. 12, Q. 10, ",Tp. Hồ Chí Minh (TPHCM),(028) 38628615                                , ,,Khoáng Sản - Công Ty Khoáng Sản
313,Công Ty Khai Thác Chế Biến Khoáng Sản Xuất Khẩu,"4 Đình Hương, ",Thanh Hóa,(0237) 3961130                                 , ,,Khoáng Sản - Công Ty Khoáng Sản
314,Tường Phú - Công Ty TNHH Xây Dựng Thương Mại & Xuất Nhập Khẩu Tường Phú,"62/22 Đinh Bộ Lĩnh, P. 26, Q. Bình Thạnh, ",Tp. Hồ Chí Minh (TPHCM),(028) 35113763                                , ,,Khoáng Sản - Công Ty Khoáng Sản
315,Thuận Phú-Bình Định - Công Ty TNHH Khoáng Sản Thuận Phú-Bình Định,"43 Lê Quý Đôn, Tp. Quy Nhơn, ",Bình Định,(0256) 3818258                                 , ,,Khoáng Sản - Công Ty Khoáng Sản
316,Thành Tâm - Công Ty Cổ Phần Thành Tâm,"Thôn Khánh Thọ,X. Tam Thái, H. Phú Ninh, ",Quảng Nam,(0235) 6272792                                 , ,,Khoáng Sản - Công Ty Khoáng Sản
317,Công Ty CP Khoáng Sản Phương Nam,"106 Văn Cao, Q. Ngô Quyền, ",Tp. Hải Phòng,0944668868                              ,trungvu68@gmail.com                               ,http://khoangsanphuongnam.com,Khoáng Sản - Công Ty Khoáng Sản
318,Alatca - Công Ty Cổ Phần Alatca,"4A Láng Hạ, Q. Đống Đa, ",Hà Nội,(024) 37725361                                ,caominh@khoangsanalatca.com                       ,,Khoáng Sản - Công Ty Khoáng Sản
319,Vpđd - Công Ty Cổ Phần Phát Triển Khoáng Sản 6,"136 Hồ Bá Kiện, P. 15, Q. 10, ",Tp. Hồ Chí Minh (TPHCM),(028) 39707485                                , ,,Khoáng Sản - Công Ty Khoáng Sản
320,Vĩnh Toàn - Công Ty TNHH Một Thành Viên Vĩnh Toàn,"Khối 7, TT. Khâm Đức, H. Phước Sơn, ",Quảng Nam,(0235) 3881555                                 , ,,Khoáng Sản - Công Ty Khoáng Sản
321,Công Ty TNHH Đầu Tư Và Thương Mại Khoáng Sản Thành Phát,"Số 39A, Tổ 9, P. Mộ Lao, Q. Hà Đông, ",Hà Nội,0988377031                              ,khoangsanthanhphat@gmail.com                      ,http://khoangsanthanhphat.com,Khoáng Sản - Công Ty Khoáng Sản
322,Công Ty Cổ Phần Khai Thác Khoáng Sản Tây Ninh,"15 Võ Thị Sáu, P. 3, TP. Tây Ninh, ",Tây Ninh,(0276) 3818677                                 ,tanimico@yahoo.com.vn                             ,,Khoáng Sản - Công Ty Khoáng Sản
323,Đất Quảng Chu Lai - Công Ty Cổ Phần Đất Quảng Chu Lai,"Khối 2,Phạm Văn Đồng, TT. Núi Thành, H. Núi Thành, ",Quảng Nam,(0235) 2244008                                 , ,,Khoáng Sản - Công Ty Khoáng Sản
324,Công Ty Rarraprodex Đất Hiếm,"6 Phạm Ngũ Lão, Q. Hoàn Kiếm, ",Hà Nội,(024) 38264694                                , ,,Khoáng Sản - Công Ty Khoáng Sản
